property_id,address,longitude,latitude,coordinates,geocode_success
17589206,"19 Pach Road Wantirna, South, VIC 3152",145.245136,-37.856367,POINT (145.245136 -37.856367),True
16566039,"Flat Rock Road, Laharum, VIC 3401",142.39475,-36.84572,POINT (142.39475 -36.84572),True
16954148,"Sutton Street, Warragul, VIC 3820",145.928291,-38.151381,POINT (145.928291 -38.151381),True
17531364,"Smokebox Court, Warragul, VIC 3820",145.934879,-38.161766,POINT (145.934879 -38.161766),True
17629953,"Winslow Crescent, Warragul, VIC 3820",145.934879,-38.161766,POINT (145.934879 -38.161766),True
17630695,"Hart Drive, Warragul, VIC 3820",145.934879,-38.161766,POINT (145.934879 -38.161766),True
17633168,"53a Latrobe Street, Warragul, VIC 3820",145.923228,-38.15539,POINT (145.923228 -38.15539),True
17634173,"Regent Avenue, Warragul, VIC 3820",145.934879,-38.161766,POINT (145.934879 -38.161766),True
17634491,"Charles Street, Warragul, VIC 3820",145.934956,-38.146928,POINT (145.934956 -38.146928),True
17635417,"1a Archibald Crescent, Warragul, VIC 3820",145.920825,-38.164489,POINT (145.920825 -38.164489),True
17637112,"23 Mason Street, Warragul, VIC 3820",145.933381,-38.162252,POINT (145.933381 -38.162252),True
17640148,"Stoll Street, Warragul, VIC 3820",145.942771,-38.156034,POINT (145.942771 -38.156034),True
17641196,"Limestone Court, Warragul, VIC 3820",145.91058,-38.150553,POINT (145.91058 -38.150553),True
17645009,"Albert Road, Warragul, VIC 3820",145.949329,-38.162354,POINT (145.949329 -38.162354),True
17645891,"Snows Hill Avenue, Warragul, VIC 3820",145.934879,-38.161766,POINT (145.934879 -38.161766),True
17646184,"Coventry Drive, Warragul, VIC 3820",145.953504,-38.142134,POINT (145.953504 -38.142134),True
17647597,"Smith Street, Warragul, VIC 3820",145.932178,-38.160576,POINT (145.932178 -38.160576),True
17649565,"Bunya Street, Warragul, VIC 3820",145.954244,-38.150279,POINT (145.954244 -38.150279),True
17653874,"Kendal Avenue, Warragul, VIC 3820",145.906526,-38.145732,POINT (145.906526 -38.145732),True
17654627,"Mills Road, Warragul, VIC 3820",145.954871,-38.140982,POINT (145.954871 -38.140982),True
17655544,"16 Cambridge Drive, Warragul, VIC 3820",145.94117,-38.159658,POINT (145.94117 -38.159658),True
17655848,"Copelands Road, Warragul, VIC 3820",145.962476,-38.145188,POINT (145.962476 -38.145188),True
16065746,"Frank Street, Eltham, VIC 3095",145.16749,-37.707565,POINT (145.16749 -37.707565),True
17583373,"29 Lawanna Drive, Templestowe, VIC 3106",145.137185,-37.769029,POINT (145.137185 -37.769029),True
17604437,"66 George Street Doncaster, East, VIC 3109",145.155262,-37.78237,POINT (145.155262 -37.78237),True
17616343,"Boronia Grove Doncaster, East, VIC 3109",145.15627,-37.799419,POINT (145.15627 -37.799419),True
17616346,"Owens Street Doncaster, East, VIC 3109",145.14908,-37.777321,POINT (145.14908 -37.777321),True
17624314,"7 Fyfe Ave, Ringwood, VIC 3134",145.236219,-37.801898,POINT (145.236219 -37.801898),True
17634962,"243 Blackburn Road Doncaster, East, VIC 3109",145.162777,-37.782302,POINT (145.162777 -37.782302),True
17636088,"11 Mitchell Street Doncaster, East, VIC 3109",145.147796,-37.788367,POINT (145.147796 -37.788367),True
17641587,"32 Talford Street Doncaster, East, VIC 3109",145.166447,-37.790856,POINT (145.166447 -37.790856),True
17651647,"22 Wembley Gardens, Donvale, VIC 3111",145.172725,-37.790107,POINT (145.172725 -37.790107),True
17652878,"Crofton Terrace Doncaster, East, VIC 3109",145.180306,-37.76828,POINT (145.180306 -37.76828),True
17661580,"3 Dryden Street Doncaster, East, VIC 3109",145.158078,-37.787855,POINT (145.158078 -37.787855),True
17661603,"Mullum Mullum Road, Ringwood, VIC 3134",145.23866,-37.801533,POINT (145.23866 -37.801533),True
17663621,"64 Bedford Road, Ringwood, VIC 3134",145.239288,-37.817071,POINT (145.239288 -37.817071),True
17664051,"1510 Main Road, Research, VIC 3095",145.177214,-37.703667,POINT (145.177214 -37.703667),True
17664417,"3a Bambra Court Doncaster, East, VIC 3109",145.164862,-37.784705,POINT (145.164862 -37.784705),True
17664455,"Hill Street, Ringwood, VIC 3134",145.241143,-37.816023,POINT (145.241143 -37.816023),True
17665258,"Ridgeview Street, Eltham, VIC 3095",145.16328,-37.700644,POINT (145.16328 -37.700644),True
6657462,"4 Leonard Street, Dandenong, VIC 3175",145.223816,-37.974054,POINT (145.223816 -37.974054),True
13575240,"1 James Street, Dandenong, VIC 3175",145.209909,-37.977254,POINT (145.209909 -37.977254),True
16130336,"22 Close Avenue, Dandenong, VIC 3175",145.208305,-37.982264,POINT (145.208305 -37.982264),True
17592044,"Antibes Street, Parkdale, VIC 3195",145.073008,-37.991874,POINT (145.073008 -37.991874),True
17594565,"Len George Drive, Keysborough, VIC 3173",145.150034,-37.998606,POINT (145.150034 -37.998606),True
17600782,"Macgregor Street, Parkdale, VIC 3195",145.085778,-37.989454,POINT (145.085778 -37.989454),True
17601966,"Bloomfield Road, Keysborough, VIC 3173",145.175959,-37.987878,POINT (145.175959 -37.987878),True
17606920,"5 Taylor Avenue, Aspendale, VIC 3195",145.100308,-38.026061,POINT (145.100308 -38.026061),True
17614962,"Northumberland Drive, Keysborough, VIC 3173",145.163347,-38.010274,POINT (145.163347 -38.010274),True
17615837,"Sunnyvale Crescent, Keysborough, VIC 3173",145.16527,-37.995679,POINT (145.16527 -37.995679),True
17619611,"Brownfield Street, Parkdale, VIC 3195",145.084873,-37.991041,POINT (145.084873 -37.991041),True
17625573,"Matilda Drive, Keysborough, VIC 3173",145.164542,-38.001273,POINT (145.164542 -38.001273),True
17631551,"Brownfield St, Parkdale, VIC 3195",145.084873,-37.991041,POINT (145.084873 -37.991041),True
17631578,"51 Nepean Highway, Aspendale, VIC 3195",145.093623,-38.016339,POINT (145.093623 -38.016339),True
17631761,"4 Gipps Av, Mordialloc, VIC 3195",145.093085,-38.008901,POINT (145.093085 -38.008901),True
17631798,"174 Beach Road, Parkdale, VIC 3195",145.079561,-38.003016,POINT (145.079561 -38.003016),True
12890481,"Moncrieff Pde Point, Cook, VIC 3030",144.734537,-37.891236,POINT (144.734537 -37.891236),True
17339879,"Atherton Way, Werribee, VIC 3030",144.661343,-37.89479,POINT (144.661343 -37.89479),True
17486240,"Cuttriss Road Werribee, South, VIC 3030",144.678548,-37.965438,POINT (144.678548 -37.965438),True
17515569,"Sabot Close Werribee, South, VIC 3030",144.706026,-37.960794,POINT (144.706026 -37.960794),True
17536801,"Farrants Road Werribee, South, VIC 3030",144.68054,-37.959769,POINT (144.68054 -37.959769),True
17555133,"Grassbird Drive Point, Cook, VIC 3030",144.717944,-37.903931,POINT (144.717944 -37.903931),True
17561643,"Masthead Way Werribee, South, VIC 3030",144.707929,-37.963407,POINT (144.707929 -37.963407),True
17574201,"Masthead Way Werribee, South, VIC 3030",144.707929,-37.963407,POINT (144.707929 -37.963407),True
17574330,"Salinga Drive, Werribee, VIC 3030",144.661343,-37.89479,POINT (144.661343 -37.89479),True
17574714,"Aquatic Drive Werribee, South, VIC 3030",144.70645,-37.963206,POINT (144.70645 -37.963206),True
17584737,"Canopy Way, Werribee, VIC 3030",144.661343,-37.89479,POINT (144.661343 -37.89479),True
17592717,"Statesman Way Point, Cook, VIC 3030",144.779178,-37.910774,POINT (144.779178 -37.910774),True
17598011,"7 Mickleton Grove Point, Cook, VIC 3030",144.747347,-37.892836,POINT (144.747347 -37.892836),True
17602795,"33 Quay Boulevard Werribee, South, VIC 3030",144.706796,-37.965179,POINT (144.706796 -37.965179),True
17610653,"Sonder Avenue, Werribee, VIC 3030",144.661343,-37.89479,POINT (144.661343 -37.89479),True
17610930,"Richmond Cres, Werribee, VIC 3030",144.654229,-37.895785,POINT (144.654229 -37.895785),True
17617671,"Jellicoe Street, Werribee, VIC 3030",144.666885,-37.898691,POINT (144.666885 -37.898691),True
17619712,"Masthead Way Werribee, South, VIC 3030",144.707929,-37.963407,POINT (144.707929 -37.963407),True
17628697,"Captain Drive Point, Cook, VIC 3030",144.752587,-37.90884,POINT (144.752587 -37.90884),True
17629887,"5 Dewan Avenue, Werribee, VIC 3030",144.65838,-37.896329,POINT (144.65838 -37.896329),True
15952373,"632 Barkly Street West, Footscray, VIC 3012",144.873022,-37.796783,POINT (144.873022 -37.796783),True
16181109,"110 Rupert Street West, Footscray, VIC 3012",144.868844,-37.79822,POINT (144.868844 -37.79822),True
16666255,"697 Barkly Street West, Footscray, VIC 3012",144.867726,-37.796442,POINT (144.867726 -37.796442),True
17309568,"19 Waratah St West, Footscray, VIC 3012",144.868191,-37.809629,POINT (144.868191 -37.809629),True
17524404,"Wellington Street West, Footscray, VIC 3012",144.867159,-37.791698,POINT (144.867159 -37.791698),True
17556439,"21 Hampton Parade West, Footscray, VIC 3012",144.867794,-37.806699,POINT (144.867794 -37.806699),True
17590269,"Waratah Street West, Footscray, VIC 3012",144.868077,-37.809296,POINT (144.868077 -37.809296),True
17602487,"Wellington Street West, Footscray, VIC 3012",144.867159,-37.791698,POINT (144.867159 -37.791698),True
17607017,"699 Barkly Street West, Footscray, VIC 3012",144.867457,-37.796436,POINT (144.867457 -37.796436),True
17616978,"12 Clarendon Parade West, Footscray, VIC 3012",144.86915,-37.805431,POINT (144.86915 -37.805431),True
17617466,"Park Avenue West, Footscray, VIC 3012",144.866166,-37.80792,POINT (144.866166 -37.80792),True
17622140,"View Street West, Footscray, VIC 3012",144.874244,-37.791938,POINT (144.874244 -37.791938),True
17622148,"View Street West, Footscray, VIC 3012",144.874244,-37.791938,POINT (144.874244 -37.791938),True
17624434,"34 Market Street West, Footscray, VIC 3012",144.878989,-37.797459,POINT (144.878989 -37.797459),True
17626454,"657 Barkly Street West, Footscray, VIC 3012",144.871132,-37.796846,POINT (144.871132 -37.796846),True
17628595,"745 Barkly Street West, Footscray, VIC 3012",144.863412,-37.795968,POINT (144.863412 -37.795968),True
17630759,"104 Cross Street West, Footscray, VIC 3012",144.878427,-37.800294,POINT (144.878427 -37.800294),True
17631653,"699 Barkly Street West, Footscray, VIC 3012",144.867457,-37.796436,POINT (144.867457 -37.796436),True
17636450,"89 Alma Street West, Footscray, VIC 3012",144.865401,-37.793931,POINT (144.865401 -37.793931),True
17637116,"Alma Street West, Footscray, VIC 3012",144.868054,-37.793898,POINT (144.868054 -37.793898),True
15043440,"Saffron Street, Greenvale, VIC 3059",144.872819,-37.646114,POINT (144.872819 -37.646114),True
16955806,"Village Crescent, Westmeadows, VIC 3049",144.905931,-37.67256,POINT (144.905931 -37.67256),True
17135067,"Tooan Court, Westmeadows, VIC 3049",144.910429,-37.671455,POINT (144.910429 -37.671455),True
17229513,"27 Eyre Street, Westmeadows, VIC 3049",144.899611,-37.678148,POINT (144.899611 -37.678148),True
17504095,"Devenish Court, Westmeadows, VIC 3049",144.903655,-37.669773,POINT (144.903655 -37.669773),True
17528708,"Haven Court, Westmeadows, VIC 3049",144.909308,-37.670578,POINT (144.909308 -37.670578),True
17547034,"18 Kenny Street, Westmeadows, VIC 3049",144.902453,-37.675893,POINT (144.902453 -37.675893),True
17555466,"1a Glencara Close, Westmeadows, VIC 3049",144.87985,-37.679909,POINT (144.87985 -37.679909),True
17556604,"76b Raleigh Street, Westmeadows, VIC 3049",144.895704,-37.677042,POINT (144.895704 -37.677042),True
17561200,"116 Raleigh Street, Westmeadows, VIC 3049",144.891321,-37.676264,POINT (144.891321 -37.676264),True
17575443,"5 Bent Street, Westmeadows, VIC 3049",144.885042,-37.676853,POINT (144.885042 -37.676853),True
17580744,"22 Ardlie Street, Westmeadows, VIC 3049",144.889081,-37.675337,POINT (144.889081 -37.675337),True
17581524,"Campbell Street, Westmeadows, VIC 3049",144.897741,-37.677953,POINT (144.897741 -37.677953),True
17586021,"Wombat Court, Westmeadows, VIC 3049",144.882268,-37.676798,POINT (144.882268 -37.676798),True
17587550,"Graham Street, Broadmeadows, VIC 3047",144.928894,-37.691917,POINT (144.928894 -37.691917),True
17588962,"5 Eumarella Street, Tullamarine, VIC 3043",144.877264,-37.707164,POINT (144.877264 -37.707164),True
12185796,"Chambers Street, Myrtleford, VIC 3737",146.719404,-36.553516,POINT (146.719404 -36.553516),True
12185955,"Jubilee Street, Myrtleford, VIC 3737",146.720376,-36.554353,POINT (146.720376 -36.554353),True
15905053,"Rangeview Drive, Myrtleford, VIC 3737",146.731866,-36.549177,POINT (146.731866 -36.549177),True
16559047,"Mcgeehan Cres, Myrtleford, VIC 3737",146.719312,-36.554892,POINT (146.719312 -36.554892),True
16593734,"Merriang South Road, Myrtleford, VIC 3737",146.731467,-36.556239,POINT (146.731467 -36.556239),True
17502053,"Myrtle St, Myrtleford, VIC 3737",146.720775,-36.558909,POINT (146.720775 -36.558909),True
13008820,"Greenwood Grove, Traralgon, VIC 3844",146.529631,-38.194796,POINT (146.529631 -38.194796),True
16791938,"Greythorn Road, Traralgon, VIC 3844",146.55851,-38.182171,POINT (146.55851 -38.182171),True
17605800,"Sundale Road, Traralgon, VIC 3844",146.50397,-38.185096,POINT (146.50397 -38.185096),True
17606857,"Kelleher Drive, Traralgon, VIC 3844",146.533757,-38.196566,POINT (146.533757 -38.196566),True
17606983,"71 Grey Street, Traralgon, VIC 3844",146.531695,-38.192871,POINT (146.531695 -38.192871),True
17608533,"Miranda Court, Traralgon, VIC 3844",146.549734,-38.203027,POINT (146.549734 -38.203027),True
17609735,"Napier Place, Traralgon, VIC 3844",146.506674,-38.184996,POINT (146.506674 -38.184996),True
17612852,"Cross S Road, Traralgon, VIC 3844",146.533757,-38.196566,POINT (146.533757 -38.196566),True
17614518,"Wirilda Crescent, Traralgon, VIC 3844",146.510017,-38.189829,POINT (146.510017 -38.189829),True
17614874,"14a Kosciuszko Street, Traralgon, VIC 3844",146.514933,-38.202756,POINT (146.514933 -38.202756),True
17616111,"Parkwood Way, Traralgon, VIC 3844",146.515877,-38.185744,POINT (146.515877 -38.185744),True
17616432,"Monash Street, Traralgon, VIC 3844",146.55002,-38.199826,POINT (146.55002 -38.199826),True
17617298,"43 Glenview Drive, Traralgon, VIC 3844",146.559405,-38.195445,POINT (146.559405 -38.195445),True
17617682,"Airfield Road, Traralgon, VIC 3844",146.533757,-38.196566,POINT (146.533757 -38.196566),True
17618189,"Glenview Drive, Traralgon, VIC 3844",146.556816,-38.195238,POINT (146.556816 -38.195238),True
17618514,"Gordon Street, Traralgon, VIC 3844",146.5304,-38.190876,POINT (146.5304 -38.190876),True
17618614,"College Avenue, Traralgon, VIC 3844",146.549037,-38.203398,POINT (146.549037 -38.203398),True
17618654,"Mason Street, Traralgon, VIC 3844",146.550287,-38.194046,POINT (146.550287 -38.194046),True
15884002,"1 The Avenue, Windsor, VIC 3181",144.997321,-37.857655,POINT (144.997321 -37.857655),True
17096923,"152 Peel Street, Windsor, VIC 3181",144.990258,-37.855818,POINT (144.990258 -37.855818),True
17598153,"Albert Street, Windsor, VIC 3181",144.983658,-37.855393,POINT (144.983658 -37.855393),True
17616520,"Raleigh Street, Windsor, VIC 3181",144.984951,-37.852194,POINT (144.984951 -37.852194),True
17624070,"7 White Street, Windsor, VIC 3181",144.993857,-37.855282,POINT (144.993857 -37.855282),True
17625754,"Wellington Street, Windsor, VIC 3181",144.99348,-37.8549,POINT (144.99348 -37.8549),True
17633939,"3 Ellesmere Road, Windsor, VIC 3181",144.99966,-37.857325,POINT (144.99966 -37.857325),True
17636526,"Eastbourne Street, Windsor, VIC 3181",144.994727,-37.853119,POINT (144.994727 -37.853119),True
17648487,"24b Victoria Street, Windsor, VIC 3181",144.993965,-37.852617,POINT (144.993965 -37.852617),True
17656532,"Albert St, Windsor, VIC 3181",144.983658,-37.855393,POINT (144.983658 -37.855393),True
17657394,"Mcilwrick Street, Windsor, VIC 3181",144.997297,-37.856301,POINT (144.997297 -37.856301),True
17658305,"11 Raleigh Street, Windsor, VIC 3181",144.982581,-37.851735,POINT (144.982581 -37.851735),True
17658854,"11 Raleigh Street, Windsor, VIC 3181",144.982581,-37.851735,POINT (144.982581 -37.851735),True
17661435,"Peel Street, Windsor, VIC 3181",144.990191,-37.855667,POINT (144.990191 -37.855667),True
17665446,"33 James Street, Windsor, VIC 3181",144.994316,-37.854812,POINT (144.994316 -37.854812),True
17671168,"72 High Street, Windsor, VIC 3181",144.988195,-37.851347,POINT (144.988195 -37.851347),True
17672087,"High St, Windsor, VIC 3181",144.99348,-37.8549,POINT (144.99348 -37.8549),True
17673824,"205 Dandenong Rd, Windsor, VIC 3181",144.996629,-37.858004,POINT (144.996629 -37.858004),True
17676091,"210 High Street, Windsor, VIC 3181",144.995068,-37.852257,POINT (144.995068 -37.852257),True
9901737,"127 Mc Kenzie Street, Wonthaggi, VIC 3995",145.591516,-38.610785,POINT (145.591516 -38.610785),True
14475269,"Korumburra Road, Wonthaggi, VIC 3995",145.593691,-38.602484,POINT (145.593691 -38.602484),True
16841130,"25b Veronica Street, Inverloch, VIC 3996",145.710224,-38.642862,POINT (145.710224 -38.642862),True
16904677,"Peverill Crescent, Wonthaggi, VIC 3995",145.593395,-38.619664,POINT (145.593395 -38.619664),True
17479845,"93 Broome Crescent, Wonthaggi, VIC 3995",145.587417,-38.615376,POINT (145.587417 -38.615376),True
17503690,"Baillieu Street East, Wonthaggi, VIC 3995",145.591552,-38.608473,POINT (145.591552 -38.608473),True
17527705,"Brown Street, Wonthaggi, VIC 3995",145.581288,-38.613435,POINT (145.581288 -38.613435),True
17572202,"Norfolk Street, Wonthaggi, VIC 3995",145.591516,-38.610785,POINT (145.591516 -38.610785),True
17575751,"Loch Street, Wonthaggi, VIC 3995",145.599645,-38.605754,POINT (145.599645 -38.605754),True
17594465,"Anser Place, Inverloch, VIC 3996",145.75076,-38.626801,POINT (145.75076 -38.626801),True
17596997,"Griffiths Street North, Wonthaggi, VIC 3995",145.593058,-38.587899,POINT (145.593058 -38.587899),True
17604316,"3 Scarborough Street, Inverloch, VIC 3996",145.725332,-38.634522,POINT (145.725332 -38.634522),True
17607513,"53a Florida Avenue, Inverloch, VIC 3996",145.710023,-38.638282,POINT (145.710023 -38.638282),True
17613999,"Golf Street, Inverloch, VIC 3996",145.722057,-38.632825,POINT (145.722057 -38.632825),True
17614105,"Bruce Street, Inverloch, VIC 3996",145.732175,-38.630288,POINT (145.732175 -38.630288),True
17620349,"Toorak Road, Inverloch, VIC 3996",145.718263,-38.637416,POINT (145.718263 -38.637416),True
17625022,", Inverloch, VIC 3996",145.720477,-38.633625,POINT (145.720477 -38.633625),True
17627206,"Gordon Avenue, Inverloch, VIC 3996",145.72821,-38.628866,POINT (145.72821 -38.628866),True
16938465,"1b Watt Street, Gisborne, VIC 3437",144.596643,-37.489813,POINT (144.596643 -37.489813),True
17078544,"36 Stephen Street, Gisborne, VIC 3437",144.584169,-37.488367,POINT (144.584169 -37.488367),True
17555388,"Brantome Street, Gisborne, VIC 3437",144.589679,-37.487152,POINT (144.589679 -37.487152),True
17576237,"16 Warren Street, Kyneton, VIC 3444",144.465193,-37.252806,POINT (144.465193 -37.252806),True
17577180,"High Street, Kyneton, VIC 3444",144.47022,-37.259363,POINT (144.47022 -37.259363),True
17600009,"Manifold Rd, Woodend, VIC 3442",144.536693,-37.340101,POINT (144.536693 -37.340101),True
17600915,"Wallaby Run, Gisborne, VIC 3437",144.595739,-37.480487,POINT (144.595739 -37.480487),True
17610950,"75 Hamilton Street, Gisborne, VIC 3437",144.583569,-37.48733,POINT (144.583569 -37.48733),True
17616128,"Stuart Dr, Woodend, VIC 3442",144.532605,-37.339663,POINT (144.532605 -37.339663),True
17620158,"Sturt Street, Kyneton, VIC 3444",144.460914,-37.246664,POINT (144.460914 -37.246664),True
17626894,"High Street, Kyneton, VIC 3444",144.47022,-37.259363,POINT (144.47022 -37.259363),True
17627487,"Sturt Street, Kyneton, VIC 3444",144.460914,-37.246664,POINT (144.460914 -37.246664),True
17628689,"Jeffreys Street, Woodend, VIC 3442",144.52545,-37.354354,POINT (144.52545 -37.354354),True
17631021,"Walkers Road, Woodend, VIC 3442",144.544605,-37.375306,POINT (144.544605 -37.375306),True
17631055,"6 Melbourne Road, Gisborne, VIC 3437",144.593582,-37.488918,POINT (144.593582 -37.488918),True
17631118,"Urquhart Street, Woodend, VIC 3442",144.52703,-37.357974,POINT (144.52703 -37.357974),True
17631809,"6 Sturt Street, Woodend, VIC 3442",144.519756,-37.354312,POINT (144.519756 -37.354312),True
17632939,"Strathclyde Crescent, Woodend, VIC 3442",144.520759,-37.38471,POINT (144.520759 -37.38471),True
17633805,"Sunny Park Close, Gisborne, VIC 3437",144.602148,-37.481671,POINT (144.602148 -37.481671),True
16755388,", Lucknow, VIC 3875",147.655845,-37.816709,POINT (147.655845 -37.816709),True
17627057,"Clothier Crescent East, Bairnsdale, VIC 3875",147.651408,-37.829116,POINT (147.651408 -37.829116),True
17627772,"Schaeche Court, Eastwood, VIC 3875",147.632407,-37.810938,POINT (147.632407 -37.810938),True
17637414,"Bottlebrush Way, Lucknow, VIC 3875",147.655845,-37.816709,POINT (147.655845 -37.816709),True
17640805,"Hodgson Street, Bairnsdale, VIC 3875",147.614678,-37.828011,POINT (147.614678 -37.828011),True
17646334,"Gibbs Place, Bairnsdale, VIC 3875",147.611354,-37.826378,POINT (147.611354 -37.826378),True
17646603,"Turnbull Street, Bairnsdale, VIC 3875",147.619369,-37.822236,POINT (147.619369 -37.822236),True
17646605,"Barton Place, Eastwood, VIC 3875",147.628893,-37.814375,POINT (147.628893 -37.814375),True
17647149,"Orrs Road, Lucknow, VIC 3875",147.655845,-37.816709,POINT (147.655845 -37.816709),True
17647876,"Churchill Street, Bairnsdale, VIC 3875",147.611965,-37.82161,POINT (147.611965 -37.82161),True
17651118,"Lucknow Street East, Bairnsdale, VIC 3875",147.654224,-37.826639,POINT (147.654224 -37.826639),True
17656524,"Messmate Mews, Lucknow, VIC 3875",147.655845,-37.816709,POINT (147.655845 -37.816709),True
17656804,"Ridge Drive, Bairnsdale, VIC 3875",147.614768,-37.833065,POINT (147.614768 -37.833065),True
17659792,"Mckean Street, Bairnsdale, VIC 3875",147.607513,-37.823526,POINT (147.607513 -37.823526),True
17660920,"Clematis Court, Lucknow, VIC 3875",147.653202,-37.816057,POINT (147.653202 -37.816057),True
17661124,"Camden Street, Lucknow, VIC 3875",147.655845,-37.816709,POINT (147.655845 -37.816709),True
17661267,"5 Charles Street, Lucknow, VIC 3875",147.650533,-37.818192,POINT (147.650533 -37.818192),True
17662921,"Verdell Street, Bairnsdale, VIC 3875",147.572031,-37.838239,POINT (147.572031 -37.838239),True
17663210,"Callistemon Court, Lucknow, VIC 3875",147.650655,-37.815762,POINT (147.650655 -37.815762),True
17665638,"Meadow Court, Bairnsdale, VIC 3875",147.602048,-37.831839,POINT (147.602048 -37.831839),True
16243734,"Fitzrovia Drive Wyndham, Vale, VIC 3024",144.594935,-37.849423,POINT (144.594935 -37.849423),True
16871846,"Earlwood Way Wyndham, Vale, VIC 3024",144.595149,-37.850888,POINT (144.595149 -37.850888),True
17513536,"Wyndham, Vale, VIC 3024",144.608484,-37.875365,POINT (144.608484 -37.875365),True
17553492,"39 Boxer Drive Wyndham, Vale, VIC 3024",144.621893,-37.866335,POINT (144.621893 -37.866335),True
17556639,"Archer Road Wyndham, Vale, VIC 3024",144.516648,-37.829799,POINT (144.516648 -37.829799),True
17577042,"39 Boxer Dr Wyndham, Vale, VIC 3024",144.621893,-37.866335,POINT (144.621893 -37.866335),True
17585082,"Laval Street Wyndham, Vale, VIC 3024",144.516648,-37.829799,POINT (144.516648 -37.829799),True
17589897,"Fortescue Boulevard Wyndham, Vale, VIC 3024",144.603491,-37.88141,POINT (144.603491 -37.88141),True
17596844,"Eliza Grove Wyndham, Vale, VIC 3024",144.627461,-37.882196,POINT (144.627461 -37.882196),True
17597015,"Silver Gum St Wyndham, Vale, VIC 3024",144.610167,-37.881797,POINT (144.610167 -37.881797),True
17612025,"Bronwyn Way Wyndham, Vale, VIC 3024",144.516648,-37.829799,POINT (144.516648 -37.829799),True
17613476,"Debden Walk Wyndham, Vale, VIC 3024",144.586241,-37.850446,POINT (144.586241 -37.850446),True
17615257,"Manuka Grove Wyndham, Vale, VIC 3024",144.607793,-37.898525,POINT (144.607793 -37.898525),True
17617096,"Gallaxus Avenue Wyndham, Vale, VIC 3024",144.624841,-37.864056,POINT (144.624841 -37.864056),True
17617319,"Ambleside Avenue Wyndham, Vale, VIC 3024",144.608815,-37.888668,POINT (144.608815 -37.888668),True
17617987,"Ferry Close Wyndham, Vale, VIC 3024",144.625894,-37.89893,POINT (144.625894 -37.89893),True
17618017,"14 Brimpton Grove Wyndham, Vale, VIC 3024",144.614532,-37.898799,POINT (144.614532 -37.898799),True
17619160,"Melotte Place Wyndham, Vale, VIC 3024",144.516648,-37.829799,POINT (144.516648 -37.829799),True
17619377,"Grangehill Mews Wyndham, Vale, VIC 3024",144.516648,-37.829799,POINT (144.516648 -37.829799),True
17621011,"Atisha Street Wyndham, Vale, VIC 3024",144.516648,-37.829799,POINT (144.516648 -37.829799),True
15937219,"7 Stamford Street, Newborough, VIC 3825",146.276157,-38.180899,POINT (146.276157 -38.180899),True
16586347,"Dowie Street, Newborough, VIC 3825",146.295597,-38.193002,POINT (146.295597 -38.193002),True
16893366,"High Street, Moe, VIC 3825",146.265718,-38.17798,POINT (146.265718 -38.17798),True
16962708,"27 Bennett Street, Moe, VIC 3825",146.267729,-38.173139,POINT (146.267729 -38.173139),True
17634596,"Crombe Court, Newborough, VIC 3825",146.282866,-38.175752,POINT (146.282866 -38.175752),True
17636376,"Avoca Place, Moe, VIC 3825",146.246625,-38.174503,POINT (146.246625 -38.174503),True
17641836,"Bridle Road, Morwell, VIC 3840",146.433717,-38.223616,POINT (146.433717 -38.223616),True
17642544,"Winifred Street, Morwell, VIC 3840",146.403126,-38.2312,POINT (146.403126 -38.2312),True
17646402,"Gabo Way, Morwell, VIC 3840",146.438118,-38.224208,POINT (146.438118 -38.224208),True
17647062,"19 Sinclair Avenue, Morwell, VIC 3840",146.388025,-38.235777,POINT (146.388025 -38.235777),True
17647543,"Junier Street, Morwell, VIC 3840",146.42712,-38.218534,POINT (146.42712 -38.218534),True
17650687,"16 Hyland Street, Moe, VIC 3825",146.265993,-38.165768,POINT (146.265993 -38.165768),True
17650770,"Avondale Road, Morwell, VIC 3840",146.384084,-38.23612,POINT (146.384084 -38.23612),True
17656146,"Doherty Avenue, Morwell, VIC 3840",146.406227,-38.237324,POINT (146.406227 -38.237324),True
17656332,"Junier Street, Morwell, VIC 3840",146.42712,-38.218534,POINT (146.42712 -38.218534),True
17656713,"Turnley Street, Morwell, VIC 3840",146.426542,-38.224532,POINT (146.426542 -38.224532),True
