property_id,address,longitude,latitude,coordinates,geocode_success
17660938,"17 Balfour Street, Newborough, VIC 3825",146.290788,-38.186976,POINT (146.290788 -38.186976),True
17660980,"Dinwoodie Drive, Newborough, VIC 3825",146.27715,-38.176754,POINT (146.27715 -38.176754),True
17662612,"Talbot Court, Morwell, VIC 3840",146.435324,-38.225598,POINT (146.435324 -38.225598),True
17577408,"47 Wolseley Street, Orbost, VIC 3888",148.460028,-37.706426,POINT (148.460028 -37.706426),True
17613769,"Koala Court, Orbost, VIC 3888",148.453549,-37.694577,POINT (148.453549 -37.694577),True
17639481,"Nicholson Street, Orbost, VIC 3888",148.456448,-37.701001,POINT (148.456448 -37.701001),True
17646987,"Gordon Street, Orbost, VIC 3888",148.454966,-37.700854,POINT (148.454966 -37.700854),True
13001612,"1c Dodemaides, Trafalgar, VIC 3824",146.146464,-38.209552,POINT (146.146464 -38.209552),True
17530473,"26a Waterloo Road, Trafalgar, VIC 3824",146.147961,-38.207978,POINT (146.147961 -38.207978),True
17597533,"Princes Way, Trafalgar, VIC 3824",146.154994,-38.211812,POINT (146.154994 -38.211812),True
17618453,"Cross Street, Trafalgar, VIC 3824",146.157027,-38.216646,POINT (146.157027 -38.216646),True
17622779,"Brown Street, Trafalgar, VIC 3824",146.160339,-38.208019,POINT (146.160339 -38.208019),True
